{
  "popis": {
    "cs": "Vstup do budovy a základní orientace: Škola se nachází ve starší zástavbě a skládá se z několika, na sebe navazujících budov, propojených dvorem. Na dvůr navazuje zahrada a kolej pro studenty. Pro náš pohyb po celém objektu budou důležité dva na sebe kolmé směry. Hlavní orientace, to je ulice, kterou jste přišli se školou po pravé straně. V objektu je tento směr totožný se vstupem do velké auly, chodbami v hlavní budově a osami obou schodišť. Toto je pro další orientaci hlavní směr pohledu nebo chůze (dále jen HS). Směr zády kolmo k ulici bude vedlejší směr (dále bude označován jen VS). To je pohled na dům – hlavní vstupní chodba, navazující dvůr, zahrada a domov pro studenty. Stejným směrem je orientována malá aula v přízemí a propojovací chodba ve třetím patře. Budovy budou popisovány odděleně a pro zpřesnění bude vždy v daném odstavci uveden směr pohledu, od něhož je další popis odvozen. Symboly HS a VS budou uvedeny v závorkách. Malá aula a spojovací chodba ve třetím patře bude popsána v obou směrech."
  },
  "datum_mapování": {
      "datum_a_čas": "2019-09-27T09:30:00"
  },
  "mapující_subjekt": [{
    "osoba": {
      "ičo": "44992785",
      "název": "Město Brno"
      }
  }],
  "fotografie": [
    "https://www.mpb.cz/osoby-s-handicapem/informacni-hlasove-majacky-pro-nevidome/"
  ],
  "braillové_písmo": true,
  "hlasový_asistent": true,
  "vodící_linie": true,
  "vodící_pes": true
}