{
  "popis": {
    "cs": "Hrad nabízí stálé i příležitostné muzejní expozice včetně kasemat. Z vyhlídkového ochozu se nabízí ojedinělý pohled na město Brno a jeho okolí. Po telefonické domluvě možnost parkování v areálu hradu. Bezbariérový vstup do hradu je bočními dveřmi středního křídla (vpravo), asistence zajistí mobilní nájezd. Bezbariérové WC ve všech patrech.",
    "en": "The castle offers permanent and occasional museum exhibits including casemates. There is a unique view around the Brno and its surroundings from the observation deck. Parking in the castle is possible after calling the reception. Barrier-free entrance to the castle is located in the middle wing of the castle (right). Assistance will ensure a mobile entrance. Barrier-free toilets are on all floors."
  },
  "datum_mapování": {
      "datum_a_čas": "2019-09-27T09:30:00"
  },
  "mapující_subjekt": [{
    "osoba": {
      "ičo": "44992785",
      "název": "Město Brno"
      }
  }],
  "mapování_dle_metodiky": false,
  "fotografie": [
    "https://www.vozejkmap.cz/83465-verejny-zachody-pro-vozickare"
  ],
  "tělesně_postižení_toaleta_přístupnost": [
    "https://data.mvcr.gov.cz/zdroj/číselníky/stupně-přístupnosti/položky/přístupný"
  ],
  "tělesně_postižení_objekt_přístupnost": [
    "https://data.mvcr.gov.cz/zdroj/číselníky/stupně-přístupnosti/položky/přístupný"
  ],
  "objekt_vyhrazené_parkování": true,
  "vstup_hlavní_nájezd": false,
  "vstup_hlavní_plošina": false,
  "vstup_hlavní_výtah": true
}